) for {0},) สำหรับ {0},
A {0} exists between {1} and {2} (,{0} อยู่ระหว่าง {1} ถึง {2} (,
Absent,ขาด,
Accrual Journal Entry for salaries from {0} to {1},รายการบันทึกยอดคงค้างสำหรับเงินเดือนจาก {0} ถึง {1},
Add to Details,เพิ่มในรายละเอียด,
Added to details,เพิ่มในรายละเอียด,
All Jobs,งานทั้งหมด,
Allocated Leaves,ใบที่จัดสรรไว้,
Annual Salary,เงินเดือนประจำปี,
Application period cannot be across two allocation records,ระยะเวลาการสมัครต้องไม่เกินสองระเบียนการจัดสรร,
Application period cannot be outside leave allocation period,รับสมัครไม่สามารถออกจากนอกระยะเวลาการจัดสรร,
Apply Now,ลงทะเบียนเลย,
Apprentice,เด็กฝึกงาน,
Approval Status,สถานะการอนุมัติ,
Approval Status must be 'Approved' or 'Rejected',สถานะการอนุมัติ ต้อง 'อนุมัติ ' หรือ ' ปฏิเสธ ',
As per your assigned Salary Structure you cannot apply for benefits,ตามโครงสร้างค่าจ้างที่ได้รับมอบหมายคุณไม่สามารถยื่นขอผลประโยชน์ได้,
Assign,กำหนด,
Assign Salary Structure,กำหนดโครงสร้างเงินเดือน,
Assign to Employees,มอบหมายให้พนักงาน,
Assigning Structures...,การกำหนดโครงสร้าง ...,
Attendance,การดูแลรักษา,
Attendance From Date and Attendance To Date is mandatory,เข้าร่วมประชุม จาก วันที่และ การเข้าร่วมประชุม เพื่อให้ มีผลบังคับใช้ วันที่,
Attendance for employee {0} is already marked for this day,การเข้าร่วมประชุมสำหรับพนักงาน {0} ถูกทำเครื่องหมายแล้วสำหรับวันนี้,
Attendance not submitted for {0} as it is a Holiday.,การเข้าร่วมไม่ได้ส่งสำหรับ {0} เนื่องจากเป็นวันหยุด,
Bank Entries,รายการธนาคาร,
Base,ฐาน,
Beginner,ผู้เริ่มต้น,
Birthday Reminder,คำเตือนวันเกิด,
Bonus Payment Date cannot be a past date,วันที่ชำระเงินโบนัสไม่สามารถเป็นวันที่ผ่านมาได้,
Calls,โทร,
Cannot find active Leave Period,ไม่สามารถหาช่วงเวลาที่ใช้งานได้,
Casual Leave,สบาย ๆ ออก,
Claimed Amount,จำนวนเงินที่อ้างสิทธิ์,
Compensatory Off,ชดเชย ปิด,
Contact Number,เบอร์ติดต่อ,
Course,หลักสูตร,
Create Disbursement Entry,สร้างรายการการชำระเงิน,
Create Salary Slip,สร้างสลิปเงินเดือน,
Create Salary Slips,สร้างสลิปเงินเดือน,
Creating Payment Entries......,กำลังสร้างรายการการชำระเงิน ......,
Creating Salary Slips...,สร้างสลิปเงินเดือน ...,
Current,ปัจจุบัน,
Current Job Openings,เปิดงานปัจจุบัน,
Daily Work Summary,สรุปการทำงานประจำวัน,
Daily Work Summary Group,กลุ่มสรุปการทำงานรายวัน,
Date is repeated,วันที่ซ้ำแล้วซ้ำอีก,
Debit A/C Number,หักบัญชี A / C,
Deduction,การหัก,
Document Status,สถานะเอกสาร,
Earning,รายได้,
Employee A/C Number,จำนวนพนักงาน A / C,
Employee Benefits,ผลประโยชน์ของพนักงาน,
Employee Grade,เกรดพนักงาน,
Employee Referral,การแนะนำผลิตภัณฑ์ของพนักงาน,
Employee relieved on {0} must be set as 'Left',พนักงาน โล่งใจ ที่ {0} จะต้องตั้งค่า เป็น ' ซ้าย ',
Employee {0} already submited an apllication {1} for the payroll period {2},พนักงาน {0} ได้รับการส่งข้อมูลแล้ว {1} สำหรับรอบระยะเวลาการจ่ายเงินเดือน {2},
Employee {0} has no maximum benefit amount,พนักงาน {0} ไม่มีผลประโยชน์สูงสุด,
Employee {0} is not active or does not exist,พนักงาน {0} ไม่ได้ ใช้งานอยู่หรือ ไม่อยู่,
Employee {0} is on Leave on {1},พนักงาน {0} อยู่ในสถานะ Leave on {1},
Employee {0} on Half day on {1},พนักงาน {0} ในครึ่งวันในวันที่ {1},
End time cannot be before start time,เวลาสิ้นสุดไม่สามารถอยู่ก่อนเวลาเริ่มต้นได้,
Evaluation,การประเมินผล,
Event Location,สถานที่จัดงาน,
Event Name,ชื่องาน,
Expense Claim for Vehicle Log {0},การเรียกร้องค่าใช้จ่ายสำหรับยานพาหนะเข้าสู่ระบบ {0},
Expense Claim {0} already exists for the Vehicle Log,ค่าใช้จ่ายในการเรียกร้อง {0} อยู่แล้วสำหรับการเข้าสู่ระบบยานพาหนะ,
Fill the form and save it,กรอกแบบฟอร์ม และบันทึกไว้,
Filter Employees By (Optional),กรองพนักงานโดย (ไม่จำเป็น),
Fiscal Year {0} not found,ปีงบประมาณ {0} ไม่พบ,
Food,อาหาร,
For Employee,สำหรับพนักงาน,
From Date {0} cannot be after employee's relieving Date {1},จากวันที่ {0} ไม่สามารถเป็นได้หลังจากที่พนักงานลบวันที่ {1},
From Date {0} cannot be before employee's joining Date {1},จากวันที่ {0} ต้องไม่ใช่วันที่พนักงานเข้าร่วมวันที่ {1},
From date can not be less than employee's joining date,ตั้งแต่วันที่ไม่น้อยกว่าวันที่เข้าร่วมของพนักงาน,
Fuel Price,ราคาน้ำมัน,
Fuel Qty,น้ำมันเชื้อเพลิงจำนวน,
Full-time,เต็มเวลา,
Future dates not allowed,วันที่ในอนาคตไม่ได้รับอนุญาต,
Get Details From Declaration,รับรายละเอียดจากประกาศ,
Get Employees,รับพนักงาน,
Gross Pay,จ่ายขั้นต้น,
Guest,ผู้เยี่ยมชม,
Half Day,ครึ่งวัน,
Half Day Date is mandatory,Half Day Date เป็นข้อบังคับ,
Half Day Date should be between From Date and To Date,ครึ่งวันวันควรอยู่ระหว่างนับจากวันและวันที่,
Half Day Date should be in between Work From Date and Work End Date,Half Day Date ควรอยู่ระหว่าง Work From Date กับ Work End Date,
Half day date should be in between from date and to date,วันที่ครึ่งวันควรอยู่ระหว่างตั้งแต่วันที่จนถึงวันที่,
Hello,สวัสดี,
House rent paid days overlapping with {0},จำนวนวันที่เช่าบ้านที่ทับซ้อนกับ {0},
House rented dates required for exemption calculation,ต้องระบุวันที่เช่าบ้านสำหรับการคำนวณการยกเว้น,
House rented dates should be atleast 15 days apart,วันที่เช่าบ้านควรอยู่ห่างกันไม่เกิน 15 วัน,
Interest Amount,จำนวนเงินที่น่าสนใจ,
Intern,แพทย์ฝึกหัด,
Job Description,รายละเอียดตำแหน่งงาน,
Job Offer,เสนองาน,
Jobs,งาน,
Leave Approval Notification,ออกประกาศการอนุมัติ,
Leave Blocked,ฝากที่ถูกบล็อก,
Leave Encashment,ปล่อยให้เป็นเงินสด,
Leave Status Notification,ออกประกาศสถานะ,
Leave Type,ฝากประเภท,
Leave Type is madatory,ประเภทการปล่อยตัวเป็นแบบวิกลจริต,
Leave Type {0} cannot be allocated since it is leave without pay,การออกจากชนิด {0} ไม่สามารถได้รับการจัดสรรตั้งแต่มันถูกทิ้งไว้โดยไม่ต้องจ่าย,
Leave Type {0} cannot be carry-forwarded,ฝากประเภท {0} ไม่สามารถดำเนินการส่งต่อ-,
Leave Type {0} is not encashable,ปล่อยให้ประเภท {0} ไม่สามารถเข้ารหัสได้,
Leave Without Pay,ฝากโดยไม่ต้องจ่าย,
"Leave cannot be allocated before {0}, as leave balance has already been carry-forwarded in the future leave allocation record {1}",ออกจากไม่สามารถได้รับการจัดสรรก่อน {0} เป็นสมดุลลาได้รับแล้วนำติดตัวส่งต่อไปในอนาคตอันลาบันทึกจัดสรร {1},
"Leave cannot be applied/cancelled before {0}, as leave balance has already been carry-forwarded in the future leave allocation record {1}",ฝากไม่สามารถใช้ / ยกเลิกก่อน {0} เป็นสมดุลลาได้รับแล้วนำติดตัวส่งต่อไปในอนาคตอันลาบันทึกจัดสรร {1},
Leave of type {0} cannot be longer than {1},การลา ประเภท {0} ไม่สามารถ จะยาวกว่า {1},
Leaves,ใบไม้,
Leaves Allocated Successfully for {0},ใบ จัดสรร ประสบความสำเร็จ ในการ {0},
Leaves per Year,การลาต่อปี,
Lifecycle,วงจรชีวิต,
Mark Attendance,ทำเครื่องหมายการเข้าร่วม,
Max Exemption Amount cannot be greater than maximum exemption amount {0} of Tax Exemption Category {1},จำนวนยกเว้นสูงสุดไม่สามารถมากกว่าจำนวนยกเว้นสูงสุด {0} ของหมวดยกเว้นภาษี {1},
Max benefits should be greater than zero to dispense benefits,ประโยชน์สูงสุดควรมากกว่าศูนย์เพื่อจ่ายผลประโยชน์,
Maximum amount eligible for the component {0} exceeds {1},จำนวนเงินสูงสุดที่มีสิทธิ์สำหรับคอมโพเนนต์ {0} เกินกว่า {1},
Maximum benefit amount of component {0} exceeds {1},จำนวนเงินที่ได้รับประโยชน์สูงสุดของคอมโพเนนต์ {0} เกินกว่า {1},
Maximum benefit amount of employee {0} exceeds {1},จำนวนเงินที่ได้รับประโยชน์สูงสุดของพนักงาน {0} เกินกว่า {1},
Maximum leave allowed in the leave type {0} is {1},อนุญาตให้ใช้งานได้สูงสุดในประเภทการลา {0} คือ {1},
Medical,การแพทย์,
Mode of payment is required to make a payment,โหมดการชำระเงินจะต้องชำระเงิน,
More than one selection for {0} not allowed,ไม่อนุญาตให้เลือกมากกว่าหนึ่งรายการสำหรับ {0},
Net Pay,จ่ายสุทธิ,
Net Pay cannot be less than 0,จ่ายสุทธิไม่สามารถน้อยกว่า 0,
Net Salary Amount,จำนวนเงินเดือนสุทธิ,
Net pay cannot be negative,จ่ายสุทธิ ไม่สามารถ ลบ,
No Employee Found,ไม่พบพนักงาน,
No Salary Structure assigned for Employee {0} on given date {1},ไม่มีโครงสร้างเงินเดือนที่กำหนดสำหรับพนักงาน {0} ในวันที่กำหนด {1},
No Staffing Plans found for this Designation,ไม่มีแผนการจัดหาพนักงานสำหรับการกำหนดนี้,
No active or default Salary Structure found for employee {0} for the given dates,ไม่มีการใช้งานหรือเริ่มต้นโครงสร้างเงินเดือนของพนักงานพบ {0} สำหรับวันที่กำหนด,
No more updates,ไม่มีการปรับปรุงเพิ่มเติม,
No replies from,ไม่มีการตอบกลับจาก,
No salary slip found to submit for the above selected criteria OR salary slip already submitted,ไม่มีสลิปเงินเดือนที่จะส่งสำหรับเกณฑ์ที่เลือกไว้ข้างต้นหรือส่งสลิปเงินเดือนแล้ว,
Nothing to change,ไม่มีอะไรเปลี่ยนแปลง,
Notice Period,ระยะเวลาการแจ้งให้ทราบล่วงหน้า,
Only Leave Applications with status 'Approved' and 'Rejected' can be submitted,ทิ้งไว้เพียงการประยุกต์ใช้งานที่มีสถานะ &#39;อนุมัติ&#39; และ &#39;ปฏิเสธ&#39; สามารถส่ง,
Optional Holiday List not set for leave period {0},รายการวันหยุดเสริมไม่ได้ตั้งไว้สำหรับระยะเวลาการลา {0},
Part-time,Part-time,
Password policy for Salary Slips is not set,ไม่ได้ตั้งนโยบายรหัสผ่านสำหรับเงินเดือนสลิป,
Payment Days,วันชำระเงิน,
Payment of {0} from {1} to {2},การชำระเงิน {0} จาก {1} ถึง {2},
Payroll,บัญชีเงินเดือน,
Payroll Number,หมายเลขบัญชีเงินเดือน,
Piecework,งานเหมา,
Please add the remaining benefits {0} to any of the existing component,โปรดเพิ่มผลประโยชน์ที่เหลือ {0} ให้กับคอมโพเนนต์ใด ๆ ที่มีอยู่,
Please confirm once you have completed your training,โปรดยืนยันเมื่อคุณจบการฝึกอบรมแล้ว,
Please enable default incoming account before creating Daily Work Summary Group,โปรดเปิดใช้งานบัญชีขาเข้าที่เป็นค่าเริ่มต้นก่อนที่จะสร้างกลุ่มสรุปการทำงานรายวัน,
Please select Company and Designation,โปรดเลือก บริษัท และชื่อ,
Please select Employee,โปรดเลือกพนักงาน,
Please select a csv file,เลือกไฟล์ CSV,
Please set default template for Leave Approval Notification in HR Settings.,โปรดตั้งค่าเทมเพลตมาตรฐานสำหรับ Leave Approval Notification ใน HR Settings,
Please set default template for Leave Status Notification in HR Settings.,โปรดตั้งค่าเทมเพลตมาตรฐานสำหรับการแจ้งเตือนสถานะการลาออกในการตั้งค่า HR,
Please set the Company,โปรดตั้ง บริษัท,
Please set the Date Of Joining for employee {0},โปรดกำหนดวันที่เข้าร่วมสำหรับพนักงาน {0},
Please share your feedback to the training by clicking on 'Training Feedback' and then 'New',โปรดแบ่งปันความคิดเห็นของคุณในการฝึกอบรมโดยคลิกที่ &#39;Training Feedback&#39; จากนั้นคลิก &#39;New&#39;,
Please update your status for this training event,โปรดอัปเดตสถานะของคุณสำหรับกิจกรรมการฝึกอบรมนี้,
Present,นำเสนอ,
Preview Salary Slip,ดูตัวอย่างสลิปเงินเดือน,
Privilege Leave,สิทธิ ออก,
Probation,การทดลอง,
Probationary Period,ระยะเวลาการฝึกงาน,
Property,คุณสมบัติ,
Property already added,เพิ่มคุณสมบัติแล้ว,
Replies,ตอบกลับ,
Responsibilities,ความรับผิดชอบ,
Role,บทบาท,
Row {0}# Allocated amount {1} cannot be greater than unclaimed amount {2},แถว {0} # จำนวนที่จัดสรรไว้ {1} จะต้องไม่เกินจำนวนที่ไม่มีการอ้างสิทธิ์ {2},
Row {0}# Paid Amount cannot be greater than requested advance amount,แถว {0} จำนวนเงินที่ชำระแล้วต้องไม่เกินจำนวนเงินที่ขอล่วงหน้า,
Salary Slip ID,เงินเดือน ID สลิป,
Salary Slip of employee {0} already created for this period,สลิปเงินเดือนของพนักงาน {0} สร้างไว้แล้วสำหรับช่วงเวลานี้,
Salary Slip of employee {0} already created for time sheet {1},สลิปเงินเดือนของพนักงาน {0} สร้างไว้แล้วสำหรับแผ่นเวลา {1},
Salary Structure Assignment for Employee already exists,มีการกำหนดโครงสร้างเงินเดือนให้กับพนักงานแล้ว,
Salary Structure Missing,โครงสร้างเงินเดือนที่ขาดหายไป,
Salary Structure not found for employee {0} and date {1},ไม่พบโครงสร้างเงินเดือนสำหรับพนักงาน {0} และวันที่ {1},
Salary Structure should have flexible benefit component(s) to dispense benefit amount,โครงสร้างค่าจ้างควรมีองค์ประกอบของผลประโยชน์ที่ยืดหยุ่นในการจ่ายผลประโยชน์,
"Salary already processed for period between {0} and {1}, Leave application period cannot be between this date range.",เงินเดือนที่ต้องการการประมวลผลแล้วสำหรับรอบระยะเวลาระหว่าง {0} และ {1} ฝากรับสมัครไม่สามารถอยู่ระหว่างช่วงวันที่นี้,
Sanctioned Amount cannot be greater than Claim Amount in Row {0}.,ตามทำนองคลองธรรมจำนวนเงินไม่สามารถจะสูงกว่าจำนวนเงินที่เรียกร้องในแถว {0},
Score must be less than or equal to 5,คะแนน ต้องน้อยกว่า หรือ เท่ากับ 5,
Select Property,เลือก Property,
Select an employee to get the employee advance.,เลือกพนักงานเพื่อรับพนักงานล่วงหน้า,
Service Expense,ค่าใช้จ่ายในการให้บริการ,
Show Employee,แสดงพนักงาน,
Show Salary Slip,สลิปเงินเดือนที่ต้องการแสดง,
Sick Leave,ป่วย ออกจาก,
"Skipping Salary Structure Assignment for the following employees, as Salary Structure Assignment records already exists against them. {0}",ข้ามการกำหนดโครงสร้างเงินเดือนสำหรับพนักงานดังต่อไปนี้เนื่องจากมีการกำหนดโครงสร้างเงินเดือนไว้กับพวกเขาแล้ว {0},
Staffing Plan {0} already exist for designation {1},มีแผนงานการรับพนักงาน {0} อยู่แล้วสำหรับการกำหนด {1},
"Start and end dates not in a valid Payroll Period, cannot calculate {0}",วันที่เริ่มต้นและวันที่สิ้นสุดไม่อยู่ในระยะเวลาบัญชีเงินเดือนที่ถูกต้องไม่สามารถคำนวณ {0},
"Start and end dates not in a valid Payroll Period, cannot calculate {0}.",วันที่เริ่มต้นและวันที่สิ้นสุดที่ไม่อยู่ในช่วงเวลาการจ่ายเงินเดือนที่ถูกต้องไม่สามารถคำนวณได้ {0},
Stock Options,ตัวเลือกหุ้น,
Structures have been assigned successfully,กำหนดโครงสร้างสำเร็จแล้ว,
Submit Proof,ส่งหลักฐาน,
Submit Salary Slip,ส่งสลิปเงินเดือน,
Submit this to create the Employee record,ส่งสิ่งนี้เพื่อสร้างเรคคอร์ด Employee,
Submitting Salary Slips...,ส่งสลิปเงินเดือน ...,
Team Updates,การปรับปรุงทีม,
Thank you,ขอบคุณ,
The day(s) on which you are applying for leave are holidays. You need not apply for leave.,วันที่ (s) ที่คุณจะใช้สำหรับการลาวันหยุด คุณไม่จำเป็นต้องใช้สำหรับการลา,
There are more holidays than working days this month.,มี วันหยุด มากขึ้นกว่าที่ เป็น วันทำการ ในเดือนนี้,
There is no leave period in between {0} and {1},ไม่มีระยะเวลาการลาออกระหว่าง {0} ถึง {1},
This is based on the attendance of this Employee,นี้ขึ้นอยู่กับการเข้าร่วมของพนักงานนี้,
This will submit Salary Slips and create accrual Journal Entry. Do you want to proceed?,การดำเนินการนี้จะส่งสลากเงินเดือนและสร้างสมุดบันทึกรายวันคงค้าง คุณต้องการดำเนินการต่อหรือไม่?,
To date can not be equal or less than from date,ในวันที่ไม่สามารถเท่ากับหรือน้อยกว่าจากวันที่,
To date can not be less than from date,ในวันที่จะต้องไม่น้อยกว่าจากวันที่,
To date can not greater than employee's relieving date,จนถึงวันที่ไม่สามารถเกินวันลางานได้,
Total Absent,ขาดทั้งหมด,
Total Deduction,หักรวม,
Total Leaves,ใบรวม,
Total Present,ปัจจุบันทั้งหมด,
