) for {0},) สำหรับ {0},
Travel Request Costing,คำขอต้นทุนการเดินทาง,
Expense Type,ประเภทค่าใช้จ่าย,
Sponsored Amount,จำนวนเงินที่ได้รับการสนับสนุน,
Funded Amount,จำนวนเงินที่สนับสนุน,
Upload Attendance,อัพโหลดผู้เข้าร่วม,
Attendance From Date,ผู้เข้าร่วมจากวันที่,
Attendance To Date,วันที่เข้าร่วมประชุมเพื่อ,
Get Template,รับแม่แบบ,
Import Attendance,การเข้าร่วมประชุมและนำเข้า,
Upload HTML,อัพโหลด HTML,
HR-VLOG-.YYYY.-,HR-VLOG-.YYYY.-,
Odometer Reading,การอ่านมาตรวัดระยะทาง,
Current Odometer value ,ค่ามาตรวัดระยะทางปัจจุบัน,
Refuelling Details,รายละเอียดเชื้อเพลิง,
Invoice Ref,Ref ใบแจ้งหนี้,
Service Details,รายละเอียดการให้บริการ,
Vehicle Service,บริการซ่อมบำรุงรถยนต์,
Service Item,รายการบริการ,
Brake Oil,น้ำมันเบรค,
Brake Pad,ผ้าเบรค,
Clutch Plate,จานคลัทช์,
Engine Oil,น้ำมันเครื่อง,
Oil Change,เปลี่ยนถ่ายน้ำมัน,
Inspection,การตรวจสอบ,
Mileage,ระยะทาง,
Salary Slip Loan,สินเชื่อลื่น,
Loan Repayment Entry,รายการชำระคืนเงินกู้,
May,พฤษภาคม,
June,มิถุนายน,
July,กรกฎาคม,
Bank Remittance,โอนเงินผ่านธนาคาร,
Daily Work Summary Replies,สรุปการทำงานสรุปรายวัน,
Employee Advance Summary,สรุปการทำงานของพนักงาน,
Employees working on a holiday,พนักงานที่ทำงานในวันหยุด,
Monthly Attendance Sheet,แผ่นผู้เข้าร่วมรายเดือน,
Salary Register,เงินเดือนที่ต้องการสมัครสมาชิก,
Unpaid Expense Claim,การเรียกร้องค่าใช้จ่ายที่ค้างชำระ,
Payment Account is mandatory,บัญชีการชำระเงินเป็นสิ่งจำเป็น,
"If checked, the full amount will be deducted from taxable income before calculating income tax without any declaration or proof submission.",หากตรวจสอบแล้วเงินเต็มจำนวนจะถูกหักออกจากรายได้ที่ต้องเสียภาษีก่อนคำนวณภาษีเงินได้โดยไม่ต้องมีการสำแดงหรือส่งหลักฐานใด ๆ,
In Time,ภายในเวลาที่กำหนด,
Out Time,นอกเวลา,
Is Recurring,เป็นประจำ,
HRA Exemption,การยกเว้น HRA,
Monthly House Rent,ค่าเช่าบ้านรายเดือน,
Rented in Metro City,ให้เช่าในเมโทรซิตี้,
HRA as per Salary Structure,HRA ตามโครงสร้างเงินเดือน,
Annual HRA Exemption,การยกเว้น HRA ประจำปี,
Monthly HRA Exemption,การยกเว้น HRA รายเดือน,
House Rent Payment Amount,จำนวนเงินค่าเช่าบ้าน,
Rented From Date,เช่าตั้งแต่วันที่,
Rented To Date,เช่าจนถึงปัจจุบัน,
Monthly Eligible Amount,จำนวนเงินที่มีสิทธิ์ต่อเดือน,
Total Eligible HRA Exemption,การยกเว้น HRA ที่มีสิทธิ์ทั้งหมด,
Validating Employee Attendance...,กำลังตรวจสอบการเข้าร่วมของพนักงาน ...,
Submitting Salary Slips and creating Journal Entry...,การส่งสลิปเงินเดือนและการสร้างรายการบันทึก ...,
Calculate Payroll Working Days Based On,คำนวณวันทำการของเงินเดือนตาม,
Consider Unmarked Attendance As,พิจารณาการเข้าร่วมที่ไม่มีเครื่องหมายเป็น,
Fraction of Daily Salary for Half Day,เศษส่วนของเงินเดือนรายวันครึ่งวัน,
Component Type,ประเภทส่วนประกอบ,
Provident Fund,กองทุนสำรองเลี้ยงชีพ,
Additional Provident Fund,กองทุนสำรองเลี้ยงชีพเพิ่มเติม,
Provident Fund Loan,เงินกู้กองทุนสำรองเลี้ยงชีพ,
Professional Tax,ภาษีวิชาชีพ,
Is Income Tax Component,เป็นส่วนประกอบของภาษีเงินได้,
Component properties and references ,คุณสมบัติของส่วนประกอบและการอ้างอิง,
Additional Salary ,เงินเดือนเพิ่มเติม,
Unmarked days,วันที่ไม่มีเครื่องหมาย,
Absent Days,วันที่ขาด,
Conditions and Formula variable and example,เงื่อนไขและสูตรตัวแปรและตัวอย่าง,
Income Tax Deductions,การหักภาษีเงินได้,
Income Tax Component,องค์ประกอบภาษีเงินได้,
Income Tax Amount,จำนวนภาษีเงินได้,
Unmarked Days,วันที่ไม่มีเครื่องหมาย,
Jan,ม.ค.,
Feb,ก.พ.,
Mar,มี.ค.,
Apr,เม.ย.,
Aug,ส.ค.,
Sep,ก.ย.,
Oct,ต.ค.,
Nov,พ.ย.,
Dec,ธ.ค.,
Summarized View,มุมมองสรุป,
Professional Tax Deductions,การลดหย่อนภาษีอย่างมืออาชีพ,
Provident Fund Deductions,การหักเงินกองทุนสำรองเลี้ยงชีพ,
Recruitment Analytics,การวิเคราะห์การสรรหาบุคลากร,
Applicant name,ชื่อผู้สมัคร,
Job Offer status,สถานะข้อเสนองาน,
On Date,ในวันที่,
Salary Payments Based On Payment Mode,การจ่ายเงินเดือนตามโหมดการชำระเงิน,
Salary Payments via ECS,การจ่ายเงินเดือนผ่าน ECS,
Account No,เลขที่บัญชี,
IFSC,IFSC,
MICR,MICR,
PF Account,บัญชี PF,
PF Amount,PF จำนวน,
Additional PF,PF เพิ่มเติม,
PF Loan,สินเชื่อ PF,
Duplicate Entry,รายการที่ซ้ำกัน,
Please select Employee first.,กรุณาเลือกพนักงานก่อน,
To Date should be greater than From Date,ถึงวันที่ควรมากกว่า From Date,
Job Offer: {0} is already for Job Applicant: {1},ข้อเสนองาน: {0} มีไว้สำหรับผู้สมัครงานแล้ว: {1},
Only Shift Request with status 'Approved' and 'Rejected' can be submitted,สามารถส่งได้เฉพาะคำขอเปลี่ยนสถานะ &quot;อนุมัติ&quot; และ &quot;ปฏิเสธ&quot;,
Shift Assignment: {0} created for Employee: {1},การมอบหมายงานกะ: {0} สร้างขึ้นสำหรับพนักงาน: {1},
You can not request for your Default Shift: {0},คุณไม่สามารถขอ Default Shift ของคุณได้: {0},
Only Approvers can Approve this Request.,เฉพาะผู้อนุมัติเท่านั้นที่สามารถอนุมัติคำขอนี้,
Please set Payroll based on in Payroll settings,โปรดตั้งค่าการจ่ายเงินเดือนตามการตั้งค่าบัญชีเงินเดือน,
Additional Salary: {0} already exist for Salary Component: {1} for period {2} and {3},เงินเดือนเพิ่มเติม: {0} มีอยู่แล้วสำหรับองค์ประกอบเงินเดือน: {1} สำหรับช่วงเวลา {2} และ {3},
Payroll date can not be less than employee's joining date.,วันที่รับเงินเดือนต้องไม่น้อยกว่าวันที่เข้าทำงานของพนักงาน,
From date can not be less than employee's joining date.,วันที่เริ่มต้นต้องไม่น้อยกว่าวันที่เข้าทำงานของพนักงาน,
To date can not be greater than employee's relieving date.,จนถึงปัจจุบันต้องไม่เกินวันปลดประจำการของพนักงาน,
Payroll date can not be greater than employee's relieving date.,วันที่รับเงินเดือนต้องไม่เกินวันปลดหนี้ของพนักงาน,
Condition and formula,เงื่อนไขและสูตร,
Available Leaves,มีใบ,
IFSC Code,รหัส IFSC,
Others,คนอื่น ๆ,
Total Allocated Leaves,ยอดรวมใบ,
Used Leaves,ใบที่ใช้แล้ว,
PAN Number,หมายเลข PAN,
Expired Leaves,ใบหมดอายุ,
