) for {0},) สำหรับ {0},
Encrypt Salary Slips in Emails,เข้ารหัสสลิปเงินเดือนในอีเมล,
"The salary slip emailed to the employee will be password protected, the password will be generated based on the password policy.",สลิปเงินเดือนที่ส่งไปยังพนักงานจะได้รับการป้องกันด้วยรหัสผ่านรหัสผ่านจะถูกสร้างขึ้นตามนโยบายรหัสผ่าน,
Password Policy,นโยบายรหัสผ่าน,
<b>Example:</b> SAL-{first_name}-{date_of_birth.year} <br>This will generate a password like SAL-Jane-1972,<b>ตัวอย่าง:</b> SAL- {first_name} - {date_of_birth.year} <br> สิ่งนี้จะสร้างรหัสผ่านเช่น SAL-Jane-1972,
Leave Approval Notification Template,ออกจากแม่แบบการแจ้งเตือนการอนุมัติ,
Leave Status Notification Template,ออกจากเทมเพลตการแจ้งสถานะ,
Role Allowed to Create Backdated Leave Application,บทบาทที่ได้รับอนุญาตในการสร้างแอปพลิเคชันออกจากที่ล้าสมัย,
Leave Approver Mandatory In Leave Application,ปล่อยให้คำแนะนำในการสมัคร,
Show Leaves Of All Department Members In Calendar,แสดงใบสมาชิกของแผนกทั้งหมดในปฏิทิน,
Auto Leave Encashment,ปล่อยให้เป็นอัตโนมัติ,
Hiring Settings,การตั้งค่าการจ้างงาน,
Check Vacancies On Job Offer Creation,ตรวจสอบตำแหน่งว่างในการสร้างข้อเสนองาน,
Identification Document Type,ประเภทเอกสารระบุ,
Effective from,มีผลตั้งแต่,
Allow Tax Exemption,อนุญาตการยกเว้นภาษี,
"If enabled, Tax Exemption Declaration will be considered for income tax calculation.",หากเปิดใช้งานจะมีการพิจารณาใบแจ้งการยกเว้นภาษีสำหรับการคำนวณภาษีเงินได้,
Standard Tax Exemption Amount,จำนวนยกเว้นภาษีมาตรฐาน,
Taxable Salary Slabs,แผ่นเงินเดือนที่ต้องเสียภาษี,
Taxes and Charges on Income Tax,ภาษีและการเรียกเก็บภาษีเงินได้,
Other Taxes and Charges,ภาษีและค่าธรรมเนียมอื่น ๆ,
Income Tax Slab Other Charges,แผ่นภาษีเงินได้ค่าใช้จ่ายอื่น ๆ,
Min Taxable Income,รายได้ขั้นต่ำที่ต้องเสียภาษี,
Max Taxable Income,รายได้ที่ต้องเสียภาษีสูงสุด,
Applicant for a Job,สำหรับผู้สมัครงาน,
Job Opening,เปิดงาน,
Cover Letter,จดหมาย,
Resume Attachment,Resume สิ่งที่แนบมา,
Job Applicant Source,แหล่งที่มาของผู้สมัครงาน,
Applicant Email Address,ที่อยู่อีเมลของผู้สมัคร,
Awaiting Response,รอการตอบสนอง,
Job Offer Terms,เงื่อนไขการเสนองาน,
Select Terms and Conditions,เลือกข้อตกลงและเงื่อนไข,
Job Offer Term,เงื่อนไขการเสนองาน,
Offer Term,ระยะเวลาเสนอ,
Value / Description,ค่า / รายละเอียด,
Description of a Job Opening,คำอธิบายของการเปิดงาน,
Staffing Plan,แผนการจัดหาพนักงาน,
Planned number of Positions,จำนวนตำแหน่งที่วางแผนไว้,
"Job profile, qualifications required etc.",รายละเอียด งาน คุณสมบัติ ที่จำเป็น อื่น ๆ,
HR-LAL-.YYYY.-,HR-LAL-.YYYY.-,
New Leaves Allocated,ใหม่ใบจัดสรร,
Add unused leaves from previous allocations,เพิ่มใบไม่ได้ใช้จากการจัดสรรก่อนหน้า,
Unused leaves,ใบที่ไม่ได้ใช้,
Total Leaves Allocated,ใบรวมจัดสรร,
Total Leaves Encashed,จำนวนใบที่ถูก Encashed,
Leave Period,ปล่อยช่วงเวลา,
Carry Forwarded Leaves,Carry ใบ Forwarded,
Apply / Approve Leaves,สมัคร / อนุมัติใบ,
HR-LAP-.YYYY.-,HR-LAP-.YYYY.-,
Leave Balance Before Application,วันลาคงเหลือก่อน การร้องขอ,
Total Leave Days,วันที่เดินทางทั้งหมด,
Leave Approver Name,ชื่อผู้อนุมัติการลา,
Follow via Email,ผ่านทางอีเมล์ตาม,
Block Holidays on important days.,วันหยุดที่ถูกบล็อกในวันสำคัญ,
Leave Block List Name,ฝากชื่อรายการที่ถูกบล็อก,
Applies to Company,นำไปใช้กับ บริษัท,
"If not checked, the list will have to be added to each Department where it has to be applied.",ถ้าไม่ได้ตรวจสอบรายชื่อจะต้องมีการเพิ่มแต่ละแผนกที่มันจะต้องมีการใช้,
Block Days,วันที่ถูกบล็อก,
Stop users from making Leave Applications on following days.,หยุดผู้ใช้จากการทำแอพพลิเคที่เดินทางในวันที่ดังต่อไปนี้,
Leave Block List Dates,ไม่ระบุวันที่รายการบล็อก,
Allow Users,อนุญาตให้ผู้ใช้งาน,
Allow the following users to approve Leave Applications for block days.,อนุญาตให้ผู้ใช้ต่อไปเพื่อขออนุมัติการใช้งานออกวันบล็อก,
Leave Block List Allowed,ฝากรายการบล็อกอนุญาตให้นำ,
Leave Block List Allow,ฝากรายการบล็อกอนุญาตให้,
Allow User,อนุญาตให้ผู้ใช้,
Leave Block List Date,ฝากวันที่รายการบล็อก,
Block Date,บล็อกวันที่,
Leave Control Panel,ฝากแผงควบคุม,
Employment Type (optional),ประเภทการจ้างงาน (เลือกได้),
Branch (optional),สาขา (ไม่จำเป็น),
Department (optional),แผนก (ไม่จำเป็น),
Designation (optional),การกำหนด (ไม่จำเป็น),
Employee Grade (optional),เกรดพนักงาน (ไม่จำเป็น),
Employee (optional),พนักงาน (ไม่จำเป็น),
Allocate Leaves,จัดสรรใบไม้,
Carry Forward,Carry Forward,
Please select Carry Forward if you also want to include previous fiscal year's balance leaves to this fiscal year,เลือกดำเนินการต่อถ้าคุณยังต้องการที่จะรวมถึงความสมดุลในปีงบประมาณก่อนหน้านี้ออกไปในปีงบการเงิน,
New Leaves Allocated (In Days),ใบใหม่ที่จัดสรร (ในวัน),
Leave Balance,ออกจากยอดคงเหลือ,
Encashable days,วันที่เป็น Encashable,
Encashment Amount,จำนวนเงินในการขาย,
Leave Ledger Entry,ออกจากรายการบัญชีแยกประเภท,
Transaction Name,ชื่อธุรกรรม,
Is Carry Forward,เป็น Carry Forward,
Is Expired,หมดอายุแล้ว,
Is Leave Without Pay,ถูกทิ้งไว้โดยไม่ต้องจ่ายเงิน,
Holiday List for Optional Leave,รายการวันหยุดสำหรับการลาตัวเลือก,
Leave Allocations,ยกเลิกการจัดสรร,
Leave Policy Details,ปล่อยรายละเอียดนโยบาย,
Leave Policy Detail,ออกจากรายละเอียดนโยบาย,
Annual Allocation,การจัดสรรรายปี,
Leave Type Name,ฝากชื่อประเภท,
Applicable After (Working Days),ใช้ได้หลังจากวันทำงาน,
Is Optional Leave,เลือกได้,
Allow Negative Balance,อนุญาตให้ยอดคงเหลือติดลบ,
Include holidays within leaves as leaves,รวมถึงวันหยุดที่อยู่ในใบเป็นใบ,
Is Compensatory,เป็นค่าตอบแทน,
Maximum Carry Forwarded Leaves,การพกพาที่ถูกส่งต่อสูงสุด,
Expire Carry Forwarded Leaves (Days),ใบนำส่งต่อที่หมดอายุ (วัน),
Calculated in days,คำนวณเป็นวัน,
Encashment,การได้เป็นเงินสด,
Allow Encashment,อนุญาตการเก็บเงิน,
Encashment Threshold Days,วันที่เกณฑ์เกณฑ์การขาย,
Earned Leave,ได้รับลาออก,
Is Earned Leave,ได้รับลาออกแล้ว,
Earned Leave Frequency,ความถี่ที่ได้รับจากการได้รับ,
Rounding,การล้อม,
Payroll Employee Detail,เงินเดือนพนักงานรายละเอียด,
Payroll Frequency,เงินเดือนความถี่,
Fortnightly,รายปักษ์,
Bimonthly,สองเดือนต่อครั้ง,
Employees,พนักงาน,
Number Of Employees,จำนวนพนักงาน,
Employee Details,รายละเอียดของพนักงาน,
Validate Attendance,ตรวจสอบการเข้าร่วม,
Salary Slip Based on Timesheet,สลิปเงินเดือนจาก Timesheet,
Deduct Tax For Unclaimed Employee Benefits,หักภาษีสำหรับผลประโยชน์ของพนักงานที่ไม่มีการอ้างสิทธิ์,
Deduct Tax For Unsubmitted Tax Exemption Proof,หักภาษีสำหรับหลักฐานการยกเว้นภาษีที่ยังไม่ได้ส่ง,
Select Payment Account to make Bank Entry,เลือกบัญชีการชำระเงินเพื่อเข้าธนาคาร,
Salary Slips Created,วางบิลเงินเดือนแล้ว,
Salary Slips Submitted,เงินเดือนส่ง,
Payroll Periods,งวดบัญชีเงินเดือน,
Payroll Period Date,วันที่จ่ายเงินเดือน,
Purpose of Travel,วัตถุประสงค์ของการท่องเที่ยว,
Retention Bonus,โบนัสการรักษา,
Bonus Payment Date,วันที่ชำระเงินโบนัส,
Bonus Amount,จำนวนเงินโบนัส,
Depends on Payment Days,ขึ้นอยู่กับวันชำระเงิน,
Is Tax Applicable,เป็นภาษีที่ใช้บังคับได้,
Variable Based On Taxable Salary,ตัวแปรตามเงินเดือนที่ต้องเสียภาษี,
Exempted from Income Tax,ได้รับการยกเว้นภาษีเงินได้,
Round to the Nearest Integer,ปัดเศษให้เป็นจำนวนเต็มที่ใกล้ที่สุด,
Statistical Component,ส่วนประกอบทางสถิติ,
"If selected, the value specified or calculated in this component will not contribute to the earnings or deductions. However, it's value can be referenced by other components that can be added or deducted. ",หากเลือกค่าที่ระบุหรือคำนวณในองค์ประกอบนี้จะไม่นำไปสู่รายได้หรือการหักเงิน อย่างไรก็ตามค่านี้สามารถอ้างอิงโดยส่วนประกอบอื่น ๆ ที่สามารถเพิ่มหรือหักล้างได้,
Do Not Include in Total,ไม่รวมในผลรวม,
Flexible Benefits,ประโยชน์ที่ยืดหยุ่น,
Is Flexible Benefit,เป็นประโยชน์ที่ยืดหยุ่น,
Max Benefit Amount (Yearly),จำนวนเงินสวัสดิการสูงสุด (รายปี),
Only Tax Impact (Cannot Claim But Part of Taxable Income),เฉพาะผลกระทบทางภาษี (ไม่สามารถเรียกร้อง แต่เป็นส่วนหนึ่งของรายได้ที่ต้องเสียภาษี),
Create Separate Payment Entry Against Benefit Claim,สร้างรายการการชำระเงินแยกต่างหากจากการเรียกร้องค่าสินไหมทดแทน,
Amount based on formula,จำนวนเงินตามสูตรการคำนวณ,
Formula,สูตร,
Salary Detail,รายละเอียดเงินเดือน,
Component,ตัวแทน,
Do not include in total,ไม่รวมในทั้งหมด,
Default Amount,จำนวนเงินที่เริ่มต้น,
Additional Amount,จำนวนเงินเพิ่มเติม,
Tax on flexible benefit,ภาษีจากผลประโยชน์ที่ยืดหยุ่น,
Tax on additional salary,ภาษีเงินเดือนเพิ่มเติม,
Salary Structure,โครงสร้างเงินเดือน,
Working Days,วันทำการ,
Salary Slip Timesheet,Timesheet สลิปเงินเดือน,
Earnings,ผลกำไร,
Deductions,การหักเงิน,
Total in words,รวมอยู่ในคำพูด,
Salary Component for timesheet based payroll.,ตัวแทนเงินเดือนสำหรับ timesheet ตามบัญชีเงินเดือน,
Leave Encashment Amount Per Day,ปล่อยจำนวนการขายต่อวัน,
Max Benefits (Amount),ประโยชน์สูงสุด (จำนวนเงิน),
Salary breakup based on Earning and Deduction.,การล่มสลายเงินเดือนขึ้นอยู่กับกำไรและหัก,
Total Earning,กำไรรวม,
Salary Structure Assignment,การกำหนดโครงสร้างเงินเดือน,
Shift Assignment,Shift Assignment,
Shift Type,ประเภทการเปลี่ยน,
Shift Request,คำขอการเปลี่ยน,
Enable Auto Attendance,เปิดใช้งานการเข้าร่วมอัตโนมัติ,
Mark attendance based on 'Employee Checkin' for Employees assigned to this shift.,ทำเครื่องหมายการเข้าร่วมตาม &#39;การเช็คอินของพนักงาน&#39; สำหรับพนักงานที่มอบหมายให้กับการเปลี่ยนแปลงนี้,
Auto Attendance Settings,การตั้งค่าการเข้าร่วมอัตโนมัติ,
Determine Check-in and Check-out,กำหนดเช็คอินและเช็คเอาท์,
Alternating entries as IN and OUT during the same shift,สลับรายการเป็นเข้าและออกในระหว่างการเปลี่ยนแปลงเดียวกัน,
Strictly based on Log Type in Employee Checkin,ยึดตามประเภทการบันทึกใน Checkin ของพนักงานอย่างเคร่งครัด,
Working Hours Calculation Based On,การคำนวณชั่วโมงการทำงานขึ้นอยู่กับ,
First Check-in and Last Check-out,เช็คอินครั้งแรกและเช็คเอาท์ครั้งสุดท้าย,
Every Valid Check-in and Check-out,ทุกการเช็คอินและเช็คเอาท์ที่ถูกต้อง,
Begin check-in before shift start time (in minutes),เริ่มการเช็คอินก่อนเวลาเริ่มกะ (เป็นนาที),
The time before the shift start time during which Employee Check-in is considered for attendance.,เวลาก่อนเวลาเริ่มต้นกะในระหว่างที่การเช็คอินของพนักงานได้รับการพิจารณาสำหรับการเข้าร่วม,
Allow check-out after shift end time (in minutes),อนุญาตให้เช็คเอาท์หลังจากเปลี่ยนเวลาสิ้นสุด (เป็นนาที),
Time after the end of shift during which check-out is considered for attendance.,เวลาหลังจากสิ้นสุดการกะในระหว่างการพิจารณาเช็คเอาต์,
Working Hours Threshold for Half Day,เกณฑ์ชั่วโมงทำงานสำหรับครึ่งวัน,
Working hours below which Half Day is marked. (Zero to disable),ชั่วโมงการทำงานด้านล่างซึ่งทำเครื่องหมายครึ่งวัน (ศูนย์ปิดการใช้งาน),
Working Hours Threshold for Absent,เกณฑ์ชั่วโมงการทำงานสำหรับการขาดงาน,
Working hours below which Absent is marked. (Zero to disable),ชั่วโมงการทำงานด้านล่างที่ไม่มีการทำเครื่องหมาย (ศูนย์ปิดการใช้งาน),
Process Attendance After,กระบวนการเข้าร่วมหลังจาก,
Attendance will be marked automatically only after this date.,ผู้เข้าร่วมจะถูกทำเครื่องหมายอัตโนมัติหลังจากวันที่นี้เท่านั้น,
Last Sync of Checkin,ซิงค์ครั้งสุดท้ายของ Checkin,
Last Known Successful Sync of Employee Checkin. Reset this only if you are sure that all Logs are synced from all the locations. Please don't modify this if you are unsure.,การซิงค์ที่ประสบความสำเร็จครั้งล่าสุดของ Checkin ของพนักงาน รีเซ็ตนี้เฉพาะเมื่อคุณแน่ใจว่าบันทึกทั้งหมดซิงค์จากที่ตั้งทั้งหมด โปรดอย่าแก้ไขสิ่งนี้หากคุณไม่แน่ใจ,
Grace Period Settings For Auto Attendance,การตั้งค่าช่วงเวลาผ่อนผันสำหรับการเข้าร่วมอัตโนมัติ,
Enable Entry Grace Period,เปิดใช้งานช่วงเวลาผ่อนผันรายการ,
Late Entry Grace Period,เข้าช่วงเวลาผ่อนผัน,
The time after the shift start time when check-in is considered as late (in minutes).,เวลาหลังจากเวลาเริ่มกะเป็นระยะเมื่อเช็คอินถือว่าช้า (เป็นนาที),
Enable Exit Grace Period,เปิดใช้งานระยะเวลาปลอดหนี้,
Early Exit Grace Period,ช่วงเวลาผ่อนผันออกก่อนกำหนด,
The time before the shift end time when check-out is considered as early (in minutes).,เวลาก่อนเวลากะสิ้นสุดเมื่อทำการเช็คเอาท์จะถือว่าเร็ว (เป็นนาที),
Skill Name,ชื่อทักษะ,
Staffing Plan Detail,รายละเอียดแผนการจัดหาพนักงาน,
Total Estimated Budget,งบประมาณรวมโดยรวม,
Vacancies,ตำแหน่งงานว่าง,
Estimated Cost Per Position,ค่าใช้จ่ายโดยประมาณต่อตำแหน่ง,
Total Estimated Cost,ค่าใช้จ่ายโดยรวม,
Current Count,นับปัจจุบัน,
Current Openings,ช่องว่างปัจจุบัน,
Number Of Positions,จำนวนตำแหน่ง,
Taxable Salary Slab,แผ่นเงินเดือนที่ต้องเสียภาษี,
From Amount,จากจำนวนเงิน,
To Amount,เป็นจำนวนเงิน,
Percent Deduction,เปอร์เซ็นต์หักล้าง,
Training Program,หลักสูตรการฝึกอบรม,
Event Status,สถานะเหตุการณ์,
Has Certificate,มีใบรับรอง,
Seminar,สัมมนา,
Theory,ทฤษฎี,
Workshop,โรงงาน,
Conference,การประชุม,
Exam,การสอบ,
Internet,อินเทอร์เน็ต,
Self-Study,การศึกษาด้วยตนเอง,
Advance,ความก้าวหน้า,
Trainer Name,ชื่อเทรนเนอร์,
Trainer Email,เทรนเนอร์อีเมล์,
Attendees,ผู้เข้าร่วมประชุม,
Employee Emails,อีเมลพนักงาน,
Training Event Employee,กิจกรรมการฝึกอบรมพนักงาน,
Invited,ได้รับเชิญ,
Feedback Submitted,ผลตอบรับส่ง,
Training Result Employee,ผลการฝึกอบรมพนักงาน,
Travel Itinerary,กำหนดการเดินทาง,
Travel From,เดินทางจาก,
Travel To,ท่องเที่ยวไป,
Mode of Travel,โหมดการท่องเที่ยว,
Flight,เที่ยวบิน,
Train,รถไฟ,
Taxi,แท็กซี่,
Rented Car,เช่ารถ,
Meal Preference,การตั้งค่าอาหาร,
Vegetarian,มังสวิรัติ,
Non-Vegetarian,มังสวิรัติ,
Gluten Free,ปราศจากกลูเตน,
Non Diary,Non Diary,
Travel Advance Required,จำเป็นต้องเดินทางล่วงหน้า,
Departure Datetime,Datetime ออกเดินทาง,
Arrival Datetime,มาถึง Datetime,
Lodging Required,ต้องการที่พัก,
Preferred Area for Lodging,พื้นที่ที่ต้องการสำหรับที่พัก,
Check-in Date,วันที่เช็คอิน,
Check-out Date,วันที่เช็คเอาต์,
Travel Request,คำขอท่องเที่ยว,
Travel Type,ประเภทการเดินทาง,
Domestic,ในประเทศ,
International,ระหว่างประเทศ,
Travel Funding,Travel Funding,
Require Full Funding,ต้องการเงินทุนทั้งหมด,
Fully Sponsored,สนับสนุนอย่างเต็มที่,
"Partially Sponsored, Require Partial Funding",ได้รับการสนับสนุนบางส่วนต้องใช้เงินทุนบางส่วน,
Copy of Invitation/Announcement,สำเนาหนังสือเชิญ / ประกาศ,
"Details of Sponsor (Name, Location)",รายละเอียดผู้สนับสนุน (ชื่อตำแหน่ง),
Identification Document Number,หมายเลขเอกสารระบุตัวตน,
Any other details,รายละเอียดอื่น ๆ,
Costing Details,รายละเอียดการคิดต้นทุน,
Event Details,รายละเอียดกิจกรรม,
Name of Organizer,ชื่อผู้จัดงาน,
Address of Organizer,ที่อยู่ของผู้จัดงาน,
