) for {0},) สำหรับ {0},
Total advance amount cannot be greater than total sanctioned amount,จำนวนเงินที่ต้องชำระล่วงหน้าทั้งหมดต้องไม่เกินจำนวนเงินที่ได้รับอนุมัติทั้งหมด,
Total flexible benefit component amount {0} should not be less than max benefits {1},จำนวนองค์ประกอบผลประโยชน์รวมที่ยืดหยุ่น {0} ไม่ควรน้อยกว่าผลประโยชน์สูงสุด {1},
Total leaves allocated is mandatory for Leave Type {0},ใบที่จัดสรรไว้ทั้งหมดเป็นข้อบังคับสำหรับ Leave Type {0},
Total working hours should not be greater than max working hours {0},ชั่วโมงการทำงานรวมไม่ควรมากกว่าชั่วโมงการทำงานสูงสุด {0},
Training,การอบรม,
Training Event,กิจกรรมการฝึกอบรม,
Training Events,กิจกรรมการฝึกอบรม,
Training Feedback,การฝึกอบรมผลตอบรับ,
Training Result,ผลการฝึกอบรม,
Travel,การเดินทาง,
Update Response,อัปเดตการตอบกลับ,
Value missing,มูลค่าหายไป,
Variable,ตัวแปร,
Walk In,Walk In,
Warning: Leave application contains following block dates,คำเตือน: โปรแกรมออกมีวันที่บล็อกต่อไปนี้,
Website Listing,รายชื่อเว็บไซต์,
Work Summary for {0},สรุปการทำงานสำหรับ {0},
You are not authorized to approve leaves on Block Dates,คุณไม่ได้รับอนุญาตในการอนุมัติวันลา ในวันที่ถูกบล็อก,
You are not present all day(s) between compensatory leave request days,คุณไม่มีวันอยู่ระหว่างวันที่ขอชดเชยการลาออก,
You can only submit Leave Encashment for a valid encashment amount,คุณสามารถส่ง Leave Encashment ได้เพียงจำนวนเงินที่ถูกต้องเท่านั้น,
{0} already allocated for Employee {1} for period {2} to {3},{0} จัดสรรสำหรับพนักงาน {1} แล้วสำหรับรอบระยะเวลา {2} ถึง {3},
{0} applicable after {1} working days,{0} ใช้ได้หลังจาก {1} วันทำการ,
{0} is not in Optional Holiday List,{0} ไม่อยู่ในรายการวันหยุดเสริม,
{0} is not in a valid Payroll Period,{0} ไม่อยู่ในระยะเวลาการจ่ายเงินเดือนที่ถูกต้อง,
{0} must be submitted,ต้องส่ง {0} รายการ,
"{0}: Employee email not found, hence email not sent",{0}: ไม่พบอีเมลของพนักงาน อีเมล์นี้จึงไม่ได้ถูกส่ง,
{0}: From {0} of type {1},{0}: จาก {0} ประเภท {1},
Conditions,เงื่อนไข,
Percent,เปอร์เซ็นต์,
Error in some rows,เกิดข้อผิดพลาดในบางแถว,
Benefit,ประโยชน์,
Shift,เปลี่ยน,
Importing {0} of {1},การอิมพอร์ต {0} จาก {1},
'employee_field_value' and 'timestamp' are required.,ต้องระบุ &#39;employee_field_value&#39; และ &#39;timestamp&#39;,
Allocation Expired!,การจัดสรรหมดอายุ!,
Attendance Marked,ทำเครื่องหมายผู้เข้าร่วม,
Attendance has been marked as per employee check-ins,มีการทำเครื่องหมายการเข้าร่วมตามการเช็คอินของพนักงาน,
Date Range,ช่วงวันที่,
Event Link,ลิงค์กิจกรรม,
Expire Allocation,การจัดสรรที่หมดอายุ,
Fuel Expense,ค่าใช้จ่ายน้ำมันเชื้อเพลิง,
Intermediate,สื่อกลาง,
Leave application is linked with leave allocations {0}. Leave application cannot be set as leave without pay,ปล่อยให้แอ็พพลิเคชันเชื่อมโยงกับการจัดสรรการลา {0} ไม่สามารถตั้งค่าการลาได้เนื่องจากไม่ได้จ่าย,
Log Type is required for check-ins falling in the shift: {0}.,จำเป็นต้องใช้ประเภทการบันทึกสำหรับการเช็คอินที่อยู่ในกะ: {0},
No Employee found for the given employee field value. '{}': {},ไม่พบพนักงานสำหรับค่าฟิลด์พนักงานที่ระบุ &#39;{}&#39;: {},
No Leaves Allocated to Employee: {0} for Leave Type: {1},ไม่มีใบที่จัดสรรให้แก่พนักงาน: {0} สำหรับประเภทการลา: {1},
Only expired allocation can be cancelled,สามารถยกเลิกการจัดสรรที่หมดอายุเท่านั้น,
Only users with the {0} role can create backdated leave applications,เฉพาะผู้ใช้ที่มีบทบาท {0} เท่านั้นที่สามารถสร้างแอปพลิเคชันการลาที่ล้าสมัย,
Password policy cannot contain spaces or simultaneous hyphens. The format will be restructured automatically,นโยบายรหัสผ่านไม่สามารถมีช่องว่างหรือยัติภังค์ในเวลาเดียวกันได้ รูปแบบจะถูกปรับโครงสร้างโดยอัตโนมัติ,
Please enter the designation,กรุณาใส่ชื่อ,
There are no vacancies under staffing plan {0},ไม่มีตำแหน่งว่างภายใต้แผนการรับพนักงาน {0},
This employee already has a log with the same timestamp.{0},พนักงานนี้มีบันทึกที่มีการประทับเวลาเดียวกันอยู่แล้ว {0},
Timing,การจับเวลา,
To date needs to be before from date,ถึงวันที่จะต้องมาก่อนจากวันที่,
Total Early Exits,ยอดรวมก่อนออก,
Total Late Entries,ผลงานล่าช้าทั้งหมด,
Training Event:,กิจกรรมการฝึกอบรม:,
Unable to find Salary Component {0},ไม่พบองค์ประกอบเงินเดือน {0},
Unmarked Attendance for days,การเข้าร่วมที่ไม่มีเครื่องหมายเป็นเวลาหลายวัน,
Vacancies cannot be lower than the current openings,ตำแหน่งงานต้องไม่ต่ำกว่าช่องเปิดปัจจุบัน,
{} is an invalid Attendance Status.,{} เป็นสถานะการเข้าร่วมที่ไม่ถูกต้อง,
Printed On,พิมพ์บน,
No employee found,พบว่า พนักงานที่ ไม่มี,
Please setup Employee Naming System in Human Resource > HR Settings,โปรดตั้งค่าระบบการตั้งชื่อพนักงานในทรัพยากรมนุษย์&gt; การตั้งค่าทรัพยากรบุคคล,
Please setup numbering series for Attendance via Setup > Numbering Series,โปรดตั้งค่าหมายเลขลำดับสำหรับการเข้าร่วมผ่านการตั้งค่า&gt; ลำดับเลข,
Current Odometer Value should be greater than Last Odometer Value {0},ค่าของเครื่องวัดระยะทางปัจจุบันควรมากกว่าค่าของมาตรวัดระยะสุดท้าย {0},
No additional expenses has been added,ไม่มีการเพิ่มค่าใช้จ่ายใด ๆ,
{0} already exists for employee {1} and period {2},{0} มีอยู่แล้วสำหรับพนักงาน {1} และช่วงเวลา {2},
Leaves Allocated,ใบจัดสรร,
Leave Without Pay does not match with approved {} records,การออกโดยไม่ต้องจ่ายเงินไม่ตรงกับบันทึก {} ที่ได้รับอนุมัติ,
Income Tax Slab not set in Salary Structure Assignment: {0},ไม่ได้กำหนดแผ่นภาษีเงินได้ในการกำหนดโครงสร้างเงินเดือน: {0},
Income Tax Slab: {0} is disabled,แผ่นภาษีเงินได้: {0} ถูกปิดใช้งาน,
Income Tax Slab must be effective on or before Payroll Period Start Date: {0},แผ่นภาษีเงินได้ต้องมีผลในหรือก่อนวันที่เริ่มรอบระยะเวลาการจ่ายเงินเดือน: {0},
No leave record found for employee {0} on {1},ไม่พบประวัติการลาของพนักงาน {0} เมื่อวันที่ {1},
Row {0}: {1} is required in the expenses table to book an expense claim.,แถว {0}: {1} ต้องระบุในตารางค่าใช้จ่ายเพื่อจองการเรียกร้องค่าใช้จ่าย,
Set the default account for the {0} {1},ตั้งค่าบัญชีเริ่มต้นสำหรับ {0} {1},
(Half Day),(ครึ่งวัน),
Income Tax Slab,แผ่นภาษีเงินได้,
Row #{0}: Cannot set amount or formula for Salary Component {1} with Variable Based On Taxable Salary,แถว # {0}: ไม่สามารถกำหนดจำนวนเงินหรือสูตรสำหรับส่วนประกอบเงินเดือน {1} ด้วยตัวแปรตามเงินเดือนที่ต้องเสียภาษี,
Repay From Salary can be selected only for term loans,การชำระคืนจากเงินเดือนสามารถเลือกได้เฉพาะสำหรับเงินกู้ระยะยาว,
Salary Component Account,บัญชีเงินเดือนตัวแทน,
Default Bank / Cash account will be automatically updated in Salary Journal Entry when this mode is selected.,เริ่มต้นของบัญชีธนาคาร / เงินสดจะได้รับการปรับปรุงโดยอัตโนมัติในเงินเดือนวารสารรายการเมื่อโหมดนี้จะถูกเลือก,
Result,ผล,
Total Score,คะแนนรวม,
Joining Date,วันที่เข้าร่วม,
Publish on website,เผยแพร่บนเว็บไซต์,
Application Status,สถานะการสมัคร,
IN,ใน,
Remind Before,เตือนก่อน,
Reminded,เตือน,
Additional Salary,เงินเดือนเพิ่มเติม,
HR-ADS-.YY.-.MM.-,HR-ADS-.YY .-. MM.-,
Salary Component,เงินเดือนที่ต้องการตัวแทน,
Overwrite Salary Structure Amount,เขียนทับโครงสร้างเงินเดือน,
Deduct Full Tax on Selected Payroll Date,หักภาษีเต็มจำนวนในวันที่เลือกจ่ายเงินเดือน,
Payroll Date,วันที่จ่ายเงินเดือน,
Salary Component Type,เงินเดือนประเภทคอมโพเนนต์,
Appointment Letter,จดหมายนัด,
Appointment Date,วันที่นัดหมาย,
Appointment Letter Template,เทมเพลตจดหมายแต่งตั้ง,
Closing Notes,หมายเหตุการปิด,
Appointment Letter content,เนื้อหาจดหมายแต่งตั้ง,
Appraisal,การตีราคา,
HR-APR-.YY.-.MM.,HR-APR-.YY.-.MM,
For Employee Name,สำหรับชื่อของพนักงาน,
Goals,เป้าหมาย,
Total Score (Out of 5),คะแนนรวม (out of 5),
"Any other remarks, noteworthy effort that should go in the records.",ใด ๆ ข้อสังเกตอื่น ๆ ความพยายามที่น่าสังเกตว่าควรจะไปในบันทึก,
Appraisal Goal,เป้าหมายการประเมิน,
Key Responsibility Area,พื้นที่ความรับผิดชอบหลัก,
Weightage (%),weightage (%),
Score (0-5),คะแนน (0-5),
Score Earned,คะแนนที่ได้รับ,
Appraisal Template Title,หัวข้อแม่แบบประเมิน,
Appraisal Template Goal,เป้าหมายเทมเพลทประเมิน,
KRA,กระ,
Key Performance Area,พื้นที่การดำเนินงานหลัก,
HR-ATT-.YYYY.-,HR-ATT-.YYYY.-,
On Leave,ลา,
Work From Home,ทำงานที่บ้าน,
Leave Application,ใบลา,
Attendance Date,วันที่เข้าร่วม,
Attendance Request,คำขอเข้าร่วม,
Late Entry,สายเข้า,
Early Exit,ออกก่อนเวลา,
Half Day Date,ครึ่งวันวัน,
On Duty,กำลังปฏิบัติหน้าที่,
Explanation,คำอธิบาย,
Compensatory Leave Request,ขอรับการชดเชย,
Leave Allocation,การจัดสรรการลา,
Worked On Holiday,ทำงานในวันหยุด,
Work From Date,ทำงานจากวันที่,
Work End Date,วันที่สิ้นสุดงาน,
Email Sent To,ส่งอีเมลไปที่,
Select Users,เลือกผู้ใช้,
Send Emails At,ส่งอีเมล์ที่,
Reminder,การแจ้งเตือน,
Daily Work Summary Group User,ผู้ใช้กลุ่มสรุปรายวัน,
email,อีเมล์,
Department Approver,ผู้ประเมินกรม,
Approver,อนุมัติ,
Designation Skill,ทักษะการกำหนด,
Skill,ความสามารถ,
Leave Policy,ออกจากนโยบาย,
Salary Details,รายละเอียดเงินเดือน,
HR-EAD-.YYYY.-,HR-EAD-.YYYY.-,
Claimed,อ้างว่า,
Employee Attendance Tool,เครื่องมือเข้าร่วมประชุมพนักงาน,
Unmarked Attendance,เข้าร่วมประชุมที่ไม่มีเครื่องหมาย,
Employees HTML,พนักงาน HTML,
Marked Attendance,ผู้เข้าร่วมการทำเครื่องหมาย,
Marked Attendance HTML,ผู้เข้าร่วมการทำเครื่องหมาย HTML,
Employee Benefit Application,ใบสมัครผลประโยชน์ของพนักงาน,
Max Benefits (Yearly),ประโยชน์สูงสุด (รายปี),
Remaining Benefits (Yearly),สิทธิประโยชน์ที่เหลือ (รายปี),
Payroll Period,ระยะเวลาการจ่ายเงินเดือน,
Dispensed Amount (Pro-rated),จำนวนเงินที่จ่าย (Pro-rated),
Employee Benefit Application Detail,รายละเอียดการสมัครลูกจ้าง,
Earning Component,คอมโพเนนต์รายได้,
Pay Against Benefit Claim,เรียกร้องค่าสินไหมทดแทน,
Max Benefit Amount,จำนวนเงินสวัสดิการสูงสุด,
Employee Benefit Claim,การเรียกร้องค่าสินไหมทดแทนพนักงาน,
Claim Date,วันที่อ้างสิทธิ์,
Claim Benefit For,ขอรับสวัสดิการสำหรับ,
Max Amount Eligible,จำนวนเงินสูงสุดที่มีสิทธิ์,
Expense Proof,Proof ค่าใช้จ่าย,
Employee Boarding Activity,กิจกรรมการรับพนักงาน,
Activity Name,ชื่อกิจกรรม,
Required for Employee Creation,จำเป็นสำหรับการสร้างพนักงาน,
Applicable in the case of Employee Onboarding,สามารถใช้งานได้ในกรณีที่พนักงาน Onboarding,
Employee Checkin,พนักงานเช็คอิน,
Log Type,ประเภทบันทึก,
OUT,ออก,
Location / Device ID,ที่ตั้ง / รหัสอุปกรณ์,
Skip Auto Attendance,ข้ามการเข้าร่วมอัตโนมัติ,
Shift Start,เริ่มกะ,
Shift End,สิ้นสุดกะ,
Shift Actual Start,Shift เริ่มจริง,
Shift Actual End,Shift สิ้นสุดจริง,
Default Salary Structure,โครงสร้างเงินเดือนเริ่มต้น,
Employee Health Insurance,ประกันสุขภาพของพนักงาน,
Health Insurance Name,ชื่อประกันสุขภาพ,
Employee Incentive,แรงจูงใจของพนักงาน,
Incentive Amount,จำนวนเงินที่จูงใจ,
Employee Onboarding,พนักงานที่กำลังเข้าร่วม,
Notify users by email,แจ้งผู้ใช้ทางอีเมล,
Employee Onboarding Template,เทมเพลตการเข้าร่วมงานของพนักงาน,
Employee Other Income,รายได้อื่นของพนักงาน,
Employee Promotion,การส่งเสริมพนักงาน,
Promotion Date,วันที่โปรโมชัน,
Employee Promotion Details,รายละเอียดโปรโมชั่นของพนักงาน,
Employee Property History,ประวัติทรัพย์สินของพนักงาน,
Employee Separation,แยกพนักงาน,
Employee Separation Template,เทมเพลตการแบ่งแยกลูกจ้าง,
Exit Interview Summary,ออกบทสรุปการให้สัมภาษณ์,
Employee Skill,ทักษะของพนักงาน,
Proficiency,ความชำนาญ,
Evaluation Date,วันประเมินผล,
Employee Skill Map,แผนที่ความสามารถของพนักงาน,
Employee Skills,ทักษะของพนักงาน,
Trainings,การฝึกอบรม,
Employee Tax Exemption Category,หมวดหมู่การยกเว้นภาษีของพนักงาน,
Max Exemption Amount,จำนวนยกเว้นสูงสุด,
Employee Tax Exemption Declaration,ประกาศยกเว้นภาษีพนักงาน,
Declarations,การประกาศ,
Total Declared Amount,ยอดรวมที่ประกาศ,
Total Exemption Amount,ยอดรวมยกเว้น,
Employee Tax Exemption Declaration Category,หมวดหมู่การประกาศยกเว้นภาษีของพนักงาน,
Exemption Sub Category,ยกเว้นหมวดย่อย,
Exemption Category,หมวดการยกเว้น,
Maximum Exempted Amount,จำนวนเงินที่ได้รับการยกเว้นสูงสุด,
Declared Amount,ประกาศจำนวนเงิน,
Employee Tax Exemption Proof Submission,การส่งหลักฐานการได้รับการยกเว้นภาษีพนักงาน,
Submission Date,วันที่ยื่น,
Tax Exemption Proofs,หลักฐานการยกเว้นภาษี,
Total Actual Amount,จำนวนเงินรวมที่แท้จริง,
Employee Tax Exemption Proof Submission Detail,รายละเอียดการส่งหลักฐานการยกเว้นภาษีพนักงาน,
Maximum Exemption Amount,จำนวนยกเว้นสูงสุด,
Type of Proof,ประเภทของหลักฐาน,
Actual Amount,จำนวนจริง,
Employee Tax Exemption Sub Category,ประเภทยกเว้นภาษีของพนักงาน,
Tax Exemption Category,ประเภทยกเว้นภาษี,
Employee Training,การฝึกอบรมพนักงาน,
Training Date,วันที่อบรม,
Employee Transfer,โอนพนักงาน,
Transfer Date,วันโอน,
Employee Transfer Details,รายละเอียดการโอนย้ายพนักงาน,
Employee Transfer Detail,รายละเอียดการโอนย้ายพนักงาน,
Re-allocate Leaves,จัดสรรใบอีกครั้ง,
Create New Employee Id,สร้างรหัสพนักงานใหม่,
New Employee ID,รหัสพนักงานใหม่,
HR-EXP-.YYYY.-,HR-EXP-.YYYY.-,
Expense Taxes and Charges,ภาษีและค่าใช้จ่ายที่ต้องเสียไป,
Total Sanctioned Amount,จำนวนรวมตามทำนองคลองธรรม,
Total Advance Amount,ยอดรวมเงินทดรอง,
Total Claimed Amount,จำนวนรวมอ้าง,
Total Amount Reimbursed,รวมจำนวนเงินชดเชย,
Vehicle Log,ยานพาหนะเข้าสู่ระบบ,
Employees Email Id,Email รหัสพนักงาน,
More Details,รายละเอียดเพิ่มเติม,
Expense Claim Account,บัญชีค่าใช้จ่ายเรียกร้อง,
Expense Claim Advance,การเรียกร้องค่าสินไหมทดแทนล่วงหน้า,
Expense Claim Detail,รายละเอียดค่าใช้จ่ายสินไหม,
Expense Date,วันที่ค่าใช้จ่าย,
Expense Claim Type,เรียกร้องประเภทค่าใช้จ่าย,
HR Settings,ตั้งค่าทรัพยากรบุคคล,
Employee Settings,การตั้งค่า การทำงานของพนักงาน,
Expense Approver Mandatory In Expense Claim,ค่าใช้จ่ายที่จำเป็นในการเรียกร้องค่าใช้จ่าย,
Payroll Settings,การตั้งค่า บัญชีเงินเดือน,
Leave,ออกจาก,
Max working hours against Timesheet,แม็กซ์ชั่วโมงการทำงานกับ Timesheet,
Include holidays in Total no. of Working Days,รวมถึงวันหยุดในไม่รวม ของวันทําการ,
"If checked, Total no. of Working Days will include holidays, and this will reduce the value of Salary Per Day",ถ้าการตรวจสอบรวมกัน ของวันทําการจะรวมถึงวันหยุดและนี้จะช่วยลดค่าของเงินเดือนที่ต้องการต่อวัน,
"If checked, hides and disables Rounded Total field in Salary Slips",หากทำเครื่องหมายให้ซ่อนและปิดใช้งานฟิลด์ผลรวมที่ปัดเศษในสลิปเงินเดือน,
The fraction of daily wages to be paid for half-day attendance,เศษของค่าจ้างรายวันที่ต้องจ่ายสำหรับการเข้าร่วมครึ่งวัน,
Email Salary Slip to Employee,อีเมล์สลิปเงินเดือนให้กับพนักงาน,
Emails salary slip to employee based on preferred email selected in Employee,สลิปอีเมล์เงินเดือนให้กับพนักงานบนพื้นฐานของอีเมลที่ต้องการเลือกในการพนักงาน,
