) for {0},) cho {0},
"Any other remarks, noteworthy effort that should go in the records.","Bất kỳ nhận xét khác, nỗ lực đáng chú ý mà nên đi vào biên bản.",
Appraisal Goal,Thẩm định mục tiêu,
Key Responsibility Area,Trách nhiệm chính,
Weightage (%),Trọng lượng(%),
Score (0-5),Điểm số (0-5),
Score Earned,Điểm số kiếm được,
Appraisal Template Title,Thẩm định Mẫu Tiêu đề,
Appraisal Template Goal,Thẩm định mẫu Mục tiêu,
KRA,KRA,
Key Performance Area,Khu vực thực hiện chính,
HR-ATT-.YYYY.-,HR-ATT-.YYYY.-,
On Leave,Nghỉ,
Work From Home,Làm ở nhà,
Leave Application,Để lại ứng dụng,
Attendance Date,Ngày có mặt,
Attendance Request,Yêu cầu tham dự,
Late Entry,Vào trễ,
Early Exit,Xuất cảnh sớm,
Half Day Date,Kỳ hạn nửa ngày,
On Duty,Đang thi hành công vụ,
Explanation,Giải trình,
Compensatory Leave Request,Yêu cầu để lại đền bù,
Leave Allocation,Phân bổ lại,
Worked On Holiday,Làm việc vào ngày lễ,
Work From Date,Làm việc từ ngày,
Work End Date,Ngày kết thúc công việc,
Email Sent To,Thư điện tử được gửi đến,
Select Users,Chọn Người dùng,
Send Emails At,Gửi email Tại,
Reminder,Nhắc nhở,
Daily Work Summary Group User,Người sử dụng Nhóm Tóm lược công việc hàng ngày,
email,e-mail,
Department Approver,Bộ phê duyệt,
Approver,Người Xét Duyệt,
Designation Skill,Kỹ năng chỉ định,
Skill,Kỹ năng,
Leave Policy,Rời khỏi chính sách,
Salary Details,Chi tiết tiền lương,
HR-EAD-.YYYY.-,HR-EAD-.YYYY.-,
Claimed,Đã yêu cầu,
Employee Attendance Tool,Nhân viên Công cụ Attendance,
Unmarked Attendance,không có mặt,
Employees HTML,Nhân viên HTML,
Marked Attendance,Đánh dấu có mặt,
Marked Attendance HTML,Đánh dấu có mặt HTML,
Employee Benefit Application,Đơn xin hưởng quyền lợi cho nhân viên,
Max Benefits (Yearly),Lợi ích Tối đa (Hàng năm),
Remaining Benefits (Yearly),Lợi ích còn lại (Hàng năm),
Payroll Period,Kỳ tính lương,
Dispensed Amount (Pro-rated),Số tiền được phân phối (Được xếp hạng theo tỷ lệ),
Employee Benefit Application Detail,Chi tiết ứng dụng lợi ích nhân viên,
Earning Component,Thành phần kiếm tiền,
Pay Against Benefit Claim,Trả tiền chống khiếu nại phúc lợi,
Max Benefit Amount,Số tiền lợi ích tối đa,
Employee Benefit Claim,Khiếu nại về Quyền lợi Nhân viên,
Claim Date,Ngày yêu cầu,
Claim Benefit For,Yêu cầu quyền lợi cho,
Max Amount Eligible,Số tiền tối đa đủ điều kiện,
Expense Proof,Bằng chứng chi phí,
Employee Boarding Activity,Hoạt động lên máy bay nhân viên,
Activity Name,Tên hoạt động,
Required for Employee Creation,Bắt buộc để tạo nhân viên,
Applicable in the case of Employee Onboarding,Áp dụng trong trường hợp giới thiệu nhân viên,
Employee Checkin,Đăng ký nhân viên,
Log Type,Loại nhật ký,
OUT,NGOÀI,
Location / Device ID,ID vị trí / thiết bị,
Skip Auto Attendance,Bỏ qua tự động tham dự,
Shift Start,Thay đổi bắt đầu,
Shift End,Thay đổi kết thúc,
Shift Actual Start,Thay đổi thực tế bắt đầu,
Shift Actual End,Thay đổi thực tế kết thúc,
Default Salary Structure,Cơ cấu lương mặc định,
Employee Health Insurance,Bảo hiểm sức khỏe nhân viên,
Health Insurance Name,Tên Bảo hiểm Y tế,
Employee Incentive,Khuyến khích nhân viên,
Incentive Amount,Số tiền khuyến khích,
Employee Onboarding,Giới thiệu nhân viên,
Notify users by email,Thông báo cho người dùng qua email,
Employee Onboarding Template,Mẫu giới thiệu nhân viên,
Employee Other Income,Thu nhập khác của nhân viên,
Employee Promotion,Khuyến mãi nhân viên,
Promotion Date,Ngày khuyến mãi,
Employee Promotion Details,Chi tiết quảng cáo nhân viên,
Employee Property History,Lịch sử tài sản của nhân viên,
Employee Separation,Tách nhân viên,
Employee Separation Template,Mẫu tách nhân viên,
Exit Interview Summary,Thoát Tóm tắt phỏng vấn,
Employee Skill,Kỹ năng nhân viên,
Proficiency,Khả năng,
Evaluation Date,Ngày đánh giá,
Employee Skill Map,Bản đồ kỹ năng nhân viên,
Employee Skills,Kỹ năng nhân viên,
Trainings,Đào tạo,
Employee Tax Exemption Category,Danh mục miễn thuế của nhân viên,
Max Exemption Amount,Số tiền miễn tối đa,
Employee Tax Exemption Declaration,Tuyên bố miễn thuế nhân viên,
Declarations,Tuyên bố,
Total Declared Amount,Tổng số tiền khai báo,
Total Exemption Amount,Tổng số tiền miễn,
Employee Tax Exemption Declaration Category,Danh mục khai thuế miễn thuế cho nhân viên,
Exemption Sub Category,Danh mục phụ miễn,
Exemption Category,Danh mục miễn,
Maximum Exempted Amount,Số tiền được miễn tối đa,
Declared Amount,Số tiền khai báo,
Employee Tax Exemption Proof Submission,Gửi bằng chứng miễn thuế cho nhân viên,
Submission Date,Ngày nộp hồ sơ,
Tax Exemption Proofs,Chứng từ miễn thuế,
Total Actual Amount,Tổng số tiền thực tế,
Employee Tax Exemption Proof Submission Detail,Chi tiết thông tin nộp thuế miễn thuế của nhân viên,
Maximum Exemption Amount,Số tiền miễn tối đa,
Type of Proof,Loại bằng chứng,
Actual Amount,Số tiền thực tế,
Employee Tax Exemption Sub Category,Danh mục phụ miễn thuế cho nhân viên,
Tax Exemption Category,Danh mục miễn thuế,
Employee Training,Huấn luyện nhân viên,
Training Date,Ngày đào tạo,
Employee Transfer,Chuyển giao nhân viên,
Transfer Date,Ngày chuyển giao,
Employee Transfer Details,Chi tiết chuyển tiền của nhân viên,
Employee Transfer Detail,Chi tiết Chuyển khoản Nhân viên,
Re-allocate Leaves,Tái phân bổ lá,
Create New Employee Id,Tạo Id Nhân viên Mới,
New Employee ID,ID nhân viên mới,
HR-EXP-.YYYY.-,HR-EXP-.YYYY.-,
Expense Taxes and Charges,Chi phí thuế và phí,
Total Sanctioned Amount,Tổng số tiền bị xử phạt,
Total Advance Amount,Tổng số tiền ứng trước,
Total Claimed Amount,Tổng số tiền được công bố,
Total Amount Reimbursed,Tổng số tiền bồi hoàn,
Vehicle Log,nhật ký phương tiện,
Employees Email Id,Nhân viên Email Id,
More Details,Thêm chi tiết,
Expense Claim Account,Tài khoản chi phí khiếu nại,
Expense Claim Advance,Yêu cầu bồi thường chi phí,
Expense Claim Detail,Chi tiết Chi phí khiếu nại,
Expense Date,Ngày Chi phí,
Expense Claim Type,Loại chi phí yêu cầu bồi thường,
HR Settings,Thiết lập nhân sự,
Employee Settings,Thiết lập nhân viên,
Expense Approver Mandatory In Expense Claim,Chi phí phê duyệt bắt buộc trong yêu cầu chi tiêu,
Payroll Settings,Thiết lập bảng lương,
Leave,Rời khỏi,
Max working hours against Timesheet,Tối đa giờ làm việc với Thời khóa biểu,
Include holidays in Total no. of Working Days,Bao gồm các ngày lễ trong Tổng số. của các ngày làm việc,
"If checked, Total no. of Working Days will include holidays, and this will reduce the value of Salary Per Day","Nếu được kiểm tra, Tổng số. của ngày làm việc sẽ bao gồm các ngày lễ, và điều này sẽ làm giảm giá trị của Lương trung bình mỗi ngày",
"If checked, hides and disables Rounded Total field in Salary Slips","Nếu được chọn, ẩn và vô hiệu hóa trường Tổng số được làm tròn trong Bảng lương",
The fraction of daily wages to be paid for half-day attendance,Phần tiền lương hàng ngày phải trả khi đi học nửa ngày,
Email Salary Slip to Employee,Gửi mail bảng lương tới nhân viên,
Emails salary slip to employee based on preferred email selected in Employee,trượt email lương cho nhân viên dựa trên email ưa thích lựa chọn trong nhân viên,
Encrypt Salary Slips in Emails,Mã hóa phiếu lương trong email,
"The salary slip emailed to the employee will be password protected, the password will be generated based on the password policy.","Phiếu lương gửi qua email cho nhân viên sẽ được bảo vệ bằng mật khẩu, mật khẩu sẽ được tạo dựa trên chính sách mật khẩu.",
Password Policy,Chính sách mật khẩu,
<b>Example:</b> SAL-{first_name}-{date_of_birth.year} <br>This will generate a password like SAL-Jane-1972,<b>Ví dụ:</b> SAL- {First_name} - {date_of_birth.year} <br> Điều này sẽ tạo ra một mật khẩu như SAL-Jane-1972,
Leave Approval Notification Template,Để lại mẫu thông báo phê duyệt,
Leave Status Notification Template,Để lại mẫu thông báo trạng thái,
Role Allowed to Create Backdated Leave Application,Vai trò được phép tạo ứng dụng nghỉ việc lạc hậu,
Leave Approver Mandatory In Leave Application,Để lại phê duyệt bắt buộc trong ứng dụng Leave,
Show Leaves Of All Department Members In Calendar,Hiển thị các lá của tất cả các thành viên của bộ phận trong lịch,
Auto Leave Encashment,Tự động rời khỏi Encashment,
Hiring Settings,Cài đặt tuyển dụng,
Check Vacancies On Job Offer Creation,Kiểm tra vị trí tuyển dụng khi tạo việc làm,
Identification Document Type,Loại tài liệu,
Effective from,Có hiệu lực từ,
Allow Tax Exemption,Cho phép Miễn thuế,
"If enabled, Tax Exemption Declaration will be considered for income tax calculation.","Nếu được kích hoạt, Tờ khai Miễn thuế sẽ được xem xét để tính thuế thu nhập.",
Standard Tax Exemption Amount,Số tiền miễn thuế tiêu chuẩn,
Taxable Salary Slabs,Bảng lương chịu thuế,
Taxes and Charges on Income Tax,Thuế và Phí đối với Thuế thu nhập,
Other Taxes and Charges,Các loại thuế và phí khác,
Income Tax Slab Other Charges,Thuế thu nhập Các khoản phí khác,
Min Taxable Income,Thu nhập chịu thuế tối thiểu,
Max Taxable Income,Thu nhập chịu thuế tối đa,
Applicant for a Job,Nộp đơn xin việc,
Job Opening,Cơ hội nghề nghiệp,
Cover Letter,Thư xin việc,
Resume Attachment,Resume đính kèm,
Job Applicant Source,Nguồn ứng viên công việc,
Applicant Email Address,Địa chỉ Email của người nộp đơn,
Awaiting Response,Đang chờ Response,
Job Offer Terms,Điều khoản của việc làm,
Select Terms and Conditions,Chọn Điều khoản và Điều kiện,
Job Offer Term,Thời hạn Cung cấp việc làm,
Offer Term,Thời hạn Cung cấp,
Value / Description,Giá trị / Mô tả,
Description of a Job Opening,Mô tả công việc một Opening,
Staffing Plan,Kế hoạch nhân lực,
Planned number of Positions,Số lượng vị trí dự kiến,
"Job profile, qualifications required etc.","Hồ sơ công việc, trình độ chuyên môn cần thiết vv",
HR-LAL-.YYYY.-,HR-LAL-.YYYY.-,
New Leaves Allocated,Những sự cho phép mới được phân bổ,
Add unused leaves from previous allocations,Thêm lá không sử dụng từ phân bổ trước,
Unused leaves,Quyền nghỉ phép chưa sử dụng,
Total Leaves Allocated,Tổng số nghỉ phép được phân bố,
Total Leaves Encashed,Tổng số lá đã được nén,
Leave Period,Rời khỏi Khoảng thời gian,
Carry Forwarded Leaves,Mang lá chuyển tiếp,
Apply / Approve Leaves,Áp dụng / Phê duyệt Leaves,
HR-LAP-.YYYY.-,HR-LAP-.YYYY.-,
Leave Balance Before Application,Trước khi rời khỏi cân ứng dụng,
Total Leave Days,Tổng số ngày nghỉ phép,
Leave Approver Name,Để lại Tên Người phê duyệt,
Follow via Email,Theo qua email,
Block Holidays on important days.,Khối ngày nghỉ vào những ngày quan trọng,
Leave Block List Name,Để lại tên danh sách chặn,
Applies to Company,Áp dụng đối với Công ty,
"If not checked, the list will have to be added to each Department where it has to be applied.","Nếu không kiểm tra, danh sách sẽ phải được thêm vào mỗi Bộ, nơi nó đã được áp dụng.",
Block Days,Khối ngày,
Stop users from making Leave Applications on following days.,Ngăn chặn người dùng từ việc để lai ứng dụng vào những ngày sau.,
Leave Block List Dates,Để lại các kỳ hạn cho danh sách chặn,
Allow Users,Cho phép người sử dụng,
Allow the following users to approve Leave Applications for block days.,Cho phép người sử dụng sau phê duyệt ứng dụng Để lại cho khối ngày.,
Leave Block List Allowed,Để lại danh sách chặn cho phép,
Leave Block List Allow,Để lại danh sách chặn cho phép,
Allow User,Cho phép tài,
Leave Block List Date,Để lại kỳ hạn cho danh sách chặn,
Block Date,Khối kỳ hạn,
Leave Control Panel,Rời khỏi bảng điều khiển,
Employment Type (optional),Loại việc làm (tùy chọn),
Branch (optional),Chi nhánh (tùy chọn),
Department (optional),Bộ phận (tùy chọn),
Designation (optional),Chỉ định (tùy chọn),
Employee Grade (optional),Lớp nhân viên (không bắt buộc),
Employee (optional),Nhân viên (không bắt buộc),
Allocate Leaves,Phân bổ lá,
Carry Forward,Carry Forward,
Please select Carry Forward if you also want to include previous fiscal year's balance leaves to this fiscal year,Vui lòng chọn Carry Forward nếu bạn cũng muốn bao gồm cân bằng tài chính của năm trước để lại cho năm tài chính này,
New Leaves Allocated (In Days),Những sự cho phép mới được phân bổ (trong nhiều ngày),
Leave Balance,Trung bình còn lại,
Encashable days,Ngày có thể sửa chữa,
Encashment Amount,Số tiền Encashment,
Leave Ledger Entry,Rời khỏi sổ cái,
Transaction Name,Tên giao dịch,
Is Carry Forward,Được truyền thẳng về phía trước,
Is Expired,Hết hạn,
Is Leave Without Pay,Là nghỉ không lương,
Holiday List for Optional Leave,Danh sách kỳ nghỉ cho nghỉ phép tùy chọn,
Leave Allocations,Để lại phân bổ,
Leave Policy Details,Để lại chi tiết chính sách,
Leave Policy Detail,Để lại chi tiết chính sách,
Annual Allocation,Phân bổ hàng năm,
Leave Type Name,Loại bỏ Tên,
Applicable After (Working Days),Áp dụng sau (ngày làm việc),
Is Optional Leave,Là tùy chọn để lại,
Allow Negative Balance,Cho phép cân đối tiêu cực,
Include holidays within leaves as leaves,Bao gồm các ngày lễ trong các lần nghỉ như là các lần nghỉ,
Is Compensatory,Là đền bù,
Maximum Carry Forwarded Leaves,Lá chuyển tiếp tối đa,
Expire Carry Forwarded Leaves (Days),Hết hạn mang theo lá chuyển tiếp (ngày),
Calculated in days,Tính theo ngày,
Encashment,Encashment,
Allow Encashment,Cho phép Encashment,
Encashment Threshold Days,Ngày ngưỡng mã hóa,
Earned Leave,Nghỉ phép,
Is Earned Leave,Được nghỉ phép,
Earned Leave Frequency,Tần suất rời đi,
Rounding,Làm tròn,
Payroll Employee Detail,Chi tiết Nhân viên Chi trả,
Payroll Frequency,Chu kì phát lương,
Fortnightly,mổi tháng hai lần,
Bimonthly,hai tháng một lần,
Employees,Nhân viên,
Number Of Employees,Số lượng nhân viên,
Employee Details,Chi tiết nhân viên,
Validate Attendance,Xác thực tham dự,
Salary Slip Based on Timesheet,Phiếu lương Dựa trên bảng thời gian,
Deduct Tax For Unclaimed Employee Benefits,Thuế khấu trừ cho các quyền lợi của nhân viên chưa được xác nhận quyền sở hữu,
Deduct Tax For Unsubmitted Tax Exemption Proof,Khấu trừ thuế đối với chứng từ miễn thuế chưa nộp,
Select Payment Account to make Bank Entry,Chọn tài khoản thanh toán để làm cho Ngân hàng nhập,
Salary Slips Created,Đã tạo phiếu lương,
Salary Slips Submitted,Đã gửi phiếu lương,
Payroll Periods,Kỳ tính lương,
Payroll Period Date,Thời hạn biên chế,
Purpose of Travel,Mục đích của du lịch,
Retention Bonus,Tiền thưởng duy trì,
Bonus Payment Date,Ngày thanh toán thưởng,
Bonus Amount,Số tiền thưởng,
Depends on Payment Days,Phụ thuộc vào ngày thanh toán,
Is Tax Applicable,Thuế có thể áp dụng,
Variable Based On Taxable Salary,Biến dựa trên mức lương chịu thuế,
Exempted from Income Tax,Miễn thuế thu nhập,
Round to the Nearest Integer,Làm tròn đến số nguyên gần nhất,
Statistical Component,Hợp phần Thống kê,
"If selected, the value specified or calculated in this component will not contribute to the earnings or deductions. However, it's value can be referenced by other components that can be added or deducted. ","Nếu được chọn, giá trị được xác định hoặc tính trong thành phần này sẽ không đóng góp vào thu nhập hoặc khấu trừ. Tuy nhiên, giá trị của nó có thể được tham chiếu bởi các thành phần khác có thể được thêm vào hoặc khấu trừ.",
Do Not Include in Total,Không bao gồm trong tổng số,
Flexible Benefits,Lợi ích linh hoạt,
Is Flexible Benefit,Lợi ích linh hoạt,
Max Benefit Amount (Yearly),Số tiền lợi ích tối đa (hàng năm),
Only Tax Impact (Cannot Claim But Part of Taxable Income),Chỉ có tác động về thuế (không thể yêu cầu nhưng một phần thu nhập chịu thuế),
Create Separate Payment Entry Against Benefit Claim,Tạo khoản thanh toán riêng biệt chống lại khiếu nại lợi ích,
Amount based on formula,Số tiền dựa trên công thức,
Formula,Công thức,
Salary Detail,Chi tiết lương,
Component,Hợp phần,
Do not include in total,Không bao gồm trong tổng số,
Default Amount,Số tiền mặc định,
Additional Amount,Số tiền bổ sung,
Tax on flexible benefit,Thuế lợi ích linh hoạt,
Tax on additional salary,Thuế trên tiền lương bổ sung,
Salary Structure,Cơ cấu tiền lương,
Working Days,Ngày làm việc,
Salary Slip Timesheet,Bảng phiếu lương,
Earnings,Thu nhập,
Deductions,Các khoản giảm trừ,
Total in words,Tổng số bằng chữ,
Salary Component for timesheet based payroll.,Phần lương cho bảng thời gian biểu dựa trên bảng lương,
Leave Encashment Amount Per Day,Rời khỏi số tiền Encashment mỗi ngày,
Max Benefits (Amount),Lợi ích tối đa (Số tiền),
Salary breakup based on Earning and Deduction.,Chia tiền lương dựa trên thu nhập và khấu trừ,
Total Earning,Tổng số Lợi nhuận,
Salary Structure Assignment,Chuyển nhượng cấu trúc lương,
Shift Assignment,Chuyển nhượng Shift,
Shift Type,Loại thay đổi,
Shift Request,Yêu cầu thay đổi,
Enable Auto Attendance,Kích hoạt tự động tham dự,
Mark attendance based on 'Employee Checkin' for Employees assigned to this shift.,Đánh dấu tham dự dựa trên Check Kiểm tra nhân viên &#39;cho nhân viên được chỉ định cho ca này.,
Auto Attendance Settings,Cài đặt tham dự tự động,
Determine Check-in and Check-out,Xác định nhận phòng và trả phòng,
Alternating entries as IN and OUT during the same shift,Các mục nhập xen kẽ như IN và OUT trong cùng một ca,
Strictly based on Log Type in Employee Checkin,Dựa hoàn toàn vào Loại nhật ký trong Đăng ký nhân viên,
Working Hours Calculation Based On,Tính toán giờ làm việc dựa trên,
First Check-in and Last Check-out,Nhận phòng lần đầu và Trả phòng lần cuối,
Every Valid Check-in and Check-out,Mỗi lần nhận và trả phòng hợp lệ,
Begin check-in before shift start time (in minutes),Bắt đầu nhận phòng trước thời gian bắt đầu ca (tính bằng phút),
The time before the shift start time during which Employee Check-in is considered for attendance.,Thời gian trước khi bắt đầu ca làm việc trong đó Đăng ký nhân viên được xem xét để tham dự.,
Allow check-out after shift end time (in minutes),Cho phép trả phòng sau thời gian kết thúc ca (tính bằng phút),
Time after the end of shift during which check-out is considered for attendance.,Thời gian sau khi kết thúc ca làm việc trả phòng được xem xét để tham dự.,
Working Hours Threshold for Half Day,Ngưỡng giờ làm việc trong nửa ngày,
Working hours below which Half Day is marked. (Zero to disable),Giờ làm việc dưới đó nửa ngày được đánh dấu. (Không có để vô hiệu hóa),
Working Hours Threshold for Absent,Ngưỡng giờ làm việc vắng mặt,
Working hours below which Absent is marked. (Zero to disable),Giờ làm việc dưới đây mà vắng mặt được đánh dấu. (Không có để vô hiệu hóa),
Process Attendance After,Tham dự quá trình sau,
Attendance will be marked automatically only after this date.,Tham dự sẽ được đánh dấu tự động chỉ sau ngày này.,
Last Sync of Checkin,Đồng bộ hóa lần cuối của Checkin,
Last Known Successful Sync of Employee Checkin. Reset this only if you are sure that all Logs are synced from all the locations. Please don't modify this if you are unsure.,Được biết đến lần cuối Đồng bộ hóa thành công của nhân viên. Chỉ đặt lại điều này nếu bạn chắc chắn rằng tất cả Nhật ký được đồng bộ hóa từ tất cả các vị trí. Vui lòng không sửa đổi điều này nếu bạn không chắc chắn.,
Grace Period Settings For Auto Attendance,Cài đặt thời gian ân hạn cho tự động tham dự,
Enable Entry Grace Period,Cho phép Thời gian gia nhập,
Late Entry Grace Period,Thời gian ân hạn muộn,
The time after the shift start time when check-in is considered as late (in minutes).,Thời gian sau ca làm việc bắt đầu khi nhận phòng được coi là trễ (tính bằng phút).,
Enable Exit Grace Period,Cho phép Thoát Thời gian ân hạn,
Early Exit Grace Period,Thời gian xuất cảnh sớm,
The time before the shift end time when check-out is considered as early (in minutes).,Thời gian trước khi hết giờ làm việc khi trả phòng được coi là sớm (tính bằng phút).,
Skill Name,Tên kỹ năng,
Staffing Plan Detail,Chi tiết kế hoạch nhân sự,
Total Estimated Budget,Tổng ngân sách ước tính,
Vacancies,Vị trí Tuyển dụng,
Estimated Cost Per Position,Chi phí ước tính cho mỗi vị trí,
Total Estimated Cost,Tổng chi phí ước tính,
Current Count,Số hiện tại,
Current Openings,Mở hiện tại,
Number Of Positions,Số vị trí,
Taxable Salary Slab,Bảng lương có thể tính thuế,
From Amount,Từ số tiền,
To Amount,Đến số tiền,
Percent Deduction,Phần trăm khấu trừ,
Training Program,Chương trình đào tạo,
Event Status,Tình trạng tổ chức sự kiện,
Has Certificate,Có Chứng chỉ,
Seminar,Hội thảo,
Theory,Lý thuyết,
Workshop,xưởng,
Conference,Hội nghị,
Exam,Thi,
Internet,Internet,
Self-Study,Tự học,
Advance,Nâng cao,
Trainer Name,tên người huấn luyện,
Trainer Email,email người huấn luyện,
Attendees,Những người tham dự,
Employee Emails,Email của nhân viên,
Training Event Employee,Đào tạo nhân viên tổ chức sự kiện,
Invited,mời,
Feedback Submitted,phản hồi được gửi,
Training Result Employee,Đào tạo Kết quả của nhân viên,
Travel Itinerary,Hành trình du lịch,
Travel From,Du lịch từ,
Travel To,Đi du lịch tới,
Mode of Travel,Phương thức du lịch,
Flight,Chuyến bay,
Train,Xe lửa,
Taxi,xe tắc xi,
Rented Car,Xe thuê,
Meal Preference,Ưu đãi bữa ăn,
Vegetarian,Ăn chay,
Non-Vegetarian,Người không ăn chay,
Gluten Free,Không chứa gluten,
Non Diary,Non Diary,
Travel Advance Required,Yêu cầu trước chuyến đi,
Departure Datetime,Thời gian khởi hành,
Arrival Datetime,Thời gian đến,
Lodging Required,Yêu cầu nhà nghỉ,
Preferred Area for Lodging,Khu vực ưa thích cho nhà nghỉ,
Check-in Date,Ngày nhận phòng,
Check-out Date,Ngày trả phòng,
Travel Request,Yêu cầu du lịch,
Travel Type,Loại du lịch,
Domestic,Trong nước,
International,Quốc tế,
Travel Funding,Tài trợ du lịch,
Require Full Funding,Yêu cầu tài trợ đầy đủ,
Fully Sponsored,Hoàn toàn được tài trợ,
"Partially Sponsored, Require Partial Funding","Được tài trợ một phần, Yêu cầu tài trợ một phần",
Copy of Invitation/Announcement,Bản sao Lời mời / Thông báo,
"Details of Sponsor (Name, Location)","Thông tin chi tiết của nhà tài trợ (Tên, địa điểm)",
Identification Document Number,Mã số chứng thực,
Any other details,Mọi chi tiết khác,
Costing Details,Chi tiết Chi phí,
Event Details,chi tiết sự kiện,
Name of Organizer,Tên tổ chức,
Address of Organizer,Địa chỉ tổ chức,
Travel Request Costing,Chi phí yêu cầu du lịch,
Expense Type,Loại phí,
Sponsored Amount,Số tiền được tài trợ,
Funded Amount,Số tiền được tài trợ,
Upload Attendance,Tải lên bảo quản,
Attendance From Date,Có mặt Từ ngày,
Attendance To Date,Có mặt đến ngày,
Get Template,Nhận Mẫu,
Import Attendance,Nhập khẩu tham dự,
Upload HTML,Tải lên HTML,
HR-VLOG-.YYYY.-,HR-VLOG-.YYYY.-,
Odometer Reading,Đọc mét kế,
Current Odometer value ,Giá trị đo đường hiện tại,
Refuelling Details,Chi tiết Nạp nhiên liệu,
Invoice Ref,Tham chiếu hóa đơn,
Service Details,Chi tiết dịch vụ,
